[
  {
    "slug": "bettergov-portal",
    "title": "BetterGov.ph Portal",
    "description": "Community-led Philippine national government portal providing accessible information on government services, agencies, and officials.",
    "repositoryUrls": ["https://github.com/bettergovph/bettergov"],
    "projectUrl": "https://bettergov.ph",
    "status": "active"
  },
  {
    "slug": "budget-tracker-2026",
    "title": "2026 Budget Tracker",
    "description": "Interactive tracker for the 2026 Philippine national budget, enabling citizens to monitor government spending allocations.",
    "repositoryUrls": ["https://github.com/bettergovph/2026-budget"],
    "projectUrl": "https://2026-budget.bettergov.ph",
    "status": "active"
  },
  {
    "slug": "better-lgu",
    "title": "Better LGU",
    "description": "Directory and information platform for Philippine local government units, covering provinces, cities, and municipalities.",
    "repositoryUrls": [],
    "projectUrl": "https://lgu.bettergov.ph",
    "status": "active"
  },
  {
    "slug": "budget-tracker",
    "title": "Budget Tracker",
    "description": "Interactive platform for tracking and visualizing Philippine national budget allocations and expenditures.",
    "repositoryUrls": ["https://github.com/bettergovph/open-budget-browser"],
    "projectUrl": "https://budget.bettergov.ph",
    "status": "active"
  },
  {
    "slug": "transparency-portal",
    "title": "Transparency Portal",
    "description": "Civic transparency platform aggregating Philippine government financial and procurement data for public accountability.",
    "repositoryUrls": ["https://github.com/bettergovph/transparency-dashboard"],
    "projectUrl": "https://transparency.bettergov.ph",
    "status": "active"
  },
  {
    "slug": "open-data-portal",
    "title": "Open Data Portal",
    "description": "Public data platform providing accessible Philippine government datasets for transparency, research, and civic innovation.",
    "repositoryUrls": ["https://github.com/bettergovph/open-data-portal"],
    "projectUrl": "https://data.bettergov.ph",
    "status": "active"
  },
  {
    "slug": "bantay-ph",
    "title": "Bantay PH",
    "description": "Community-powered watchdog platform for monitoring Philippine government projects, contracts, and public spending.",
    "repositoryUrls": [],
    "projectUrl": "https://bantay.bettergov.ph",
    "status": "active"
  },
  {
    "slug": "petitions",
    "title": "Petitions",
    "description": "Online petition platform for Filipino citizens to raise civic issues and advocate for government action.",
    "repositoryUrls": ["https://github.com/bettergovph/petition"],
    "projectUrl": "https://petition.ph",
    "status": "active"
  },
  {
    "slug": "tax-directory",
    "title": "Tax Directory",
    "description": "Public-facing platform providing tax-related tools and calculators for easier citizen access to tax information.",
    "repositoryUrls": ["https://github.com/bettergovph/ph-tax-directory"],
    "projectUrl": "https://taxdirectory.bettergov.ph",
    "status": "active"
  },
  {
    "slug": "philgeps",
    "title": "Philgeps",
    "description": "BetterGov interface for exploring and monitoring Philippine Government Electronic Procurement System data.",
    "repositoryUrls": ["https://github.com/bettergovph/open-philgeps-data"],
    "projectUrl": "https://philgeps.bettergov.ph",
    "status": "active"
  },
  {
    "slug": "saln-tracker",
    "title": "SALN Tracker",
    "description": "Platform for tracking and exploring Statement of Assets, Liabilities, and Net Worth filings of Philippine public officials.",
    "repositoryUrls": ["https://github.com/bettergovph/saln-tracker-ph"],
    "projectUrl": "https://saln.bettergov.ph",
    "status": "active"
  },
  {
    "slug": "hotlines",
    "title": "Hotlines",
    "description": "Comprehensive directory of emergency and government hotlines in the Philippines.",
    "repositoryUrls": ["https://github.com/bettergovph/hotlines"],
    "projectUrl": "https://hotlines.bettergov.ph",
    "status": "active"
  },
  {
    "slug": "open-bayan",
    "title": "Open Bayan",
    "description": "Open civic data platform connecting Filipinos to barangay-level government information.",
    "repositoryUrls": ["https://github.com/bettergovph/openbayan.org"],
    "projectUrl": "https://www.openbayan.org",
    "status": "active"
  },
  {
    "slug": "open-congress-api",
    "title": "Open Congress API",
    "description": "Open API providing structured data on the Philippine Congress, including legislative records and member information.",
    "repositoryUrls": ["https://github.com/bettergovph/open-congress-api"],
    "projectUrl": "https://open-congress-api.bettergov.ph",
    "status": "active"
  },
  {
    "slug": "opengov-blockchain",
    "title": "OpenGov Blockchain",
    "description": "Blockchain-based platform for ensuring transparency and immutability of Philippine government records.",
    "repositoryUrls": [
      "https://github.com/bettergovph/govchain",
      "https://github.com/bettergovph/govchaind",
      "https://github.com/bettergovph/govchain-ts"
    ],
    "projectUrl": "https://govchain.bettergov.ph",
    "status": "active"
  },
  {
    "slug": "research-and-visualizations",
    "title": "Research & Visualizations",
    "description": "Data visualization platform presenting insights from Philippine government data through interactive charts and analyses.",
    "repositoryUrls": [
      "https://github.com/bettergovph/open-data-visualization"
    ],
    "projectUrl": "https://visualizations.bettergov.ph",
    "status": "active"
  }
]
